{
  "schema_version": "source-map-v1",
  "reference_sha256": "332B3C8C0AE0A6E40A4B93110EE16748FCD94AA0119D63F16EDE878598C681B4",
  "mapped": [
    {
      "address": 1112605740,
      "size": 148,
      "reference_names": [
        "__NSCurrentTime"
      ],
      "source_path": "src/Kits/Foundation/NSProcessInfo.m",
      "source_line": 47
    },
    {
      "address": 1112797496,
      "size": 828,
      "reference_names": [
        "__NSProcessPath"
      ],
      "source_path": "src/Kits/Foundation/NSProcessInfo.m",
      "source_line": 131
    },
    {
      "address": 1112802176,
      "size": 36,
      "reference_names": [
        "__NSArgc"
      ],
      "source_path": "src/Kits/Foundation/NSProcessInfo.m",
      "source_line": 35
    },
    {
      "address": 1112817472,
      "size": 32,
      "reference_names": [
        "__NSProcessID"
      ],
      "source_path": "src/Kits/Foundation/NSProcessInfo.m",
      "source_line": 62
    },
    {
      "address": 1112835144,
      "size": 36,
      "reference_names": [
        "__NSArgv"
      ],
      "source_path": "src/Kits/Foundation/NSProcessInfo.m",
      "source_line": 39
    },
    {
      "address": 1112892472,
      "size": 232,
      "reference_names": [
        "__NSProcessName"
      ],
      "source_path": "src/Kits/Foundation/NSProcessInfo.m",
      "source_line": 198
    },
    {
      "address": 1112901384,
      "size": 40,
      "reference_names": [
        "__NSGetDirectory2"
      ],
      "source_path": "src/Kits/Foundation/NSProcessInfo.m",
      "source_line": 85
    },
    {
      "address": 1113176200,
      "size": 44,
      "reference_names": [
        "__NSCurrentUNIXTime"
      ],
      "source_path": "src/Kits/Foundation/NSProcessInfo.m",
      "source_line": 55
    },
    {
      "address": 1113177504,
      "size": 36,
      "reference_names": [
        "__NSEnviron"
      ],
      "source_path": "src/Kits/Foundation/NSProcessInfo.m",
      "source_line": 43
    },
    {
      "address": 1113178392,
      "size": 172,
      "reference_names": [
        "__NSGetEnvironmentVariable"
      ],
      "source_path": "src/Kits/Foundation/NSProcessInfo.m",
      "source_line": 66
    },
    {
      "address": 1113181312,
      "size": 316,
      "reference_names": [
        "__NSSearchForNameInPath"
      ],
      "source_path": "src/Kits/Foundation/NSProcessInfo.m",
      "source_line": 89
    }
  ],
  "unmapped": [],
  "duplicate_candidates": [],
  "boundary_disputed": [],
  "by_module": {
    "NSProcessInfo.m": {
      "mapped": 11,
      "unmapped": 0,
      "duplicate_candidates": 0,
      "boundary_disputed": 0
    }
  }
}
